{
  "contractVersion": 1,
  "id": "remember_unverified_without_ack",
  "generatedBy": "TestPublicConformanceStructuralRejections/remember_unverified_without_ack",
  "classification": "canonical",
  "sensitiveDataPolicy": "synthetic data only; secrets, private paths, timestamps, and nondeterministic identifiers are forbidden",
  "sizeBehavior": "model-visible JSON is bounded by the kernel projection; raw tool output is excluded",
  "payload": {
    "ok": false,
    "taskId": "$TASK_ID_1",
    "summary": "cannot complete: no adequate verification was performed (receipts are absent, blocked, inconclusive, or not_run). run cortex verify with an available verifier, or set verification_not_possible=true (CLI --unverified) to record explicitly that verification could not be performed",
    "actions": [
      {
        "tool": "cortex_verify",
        "command": "cortex -C $WORKSPACE verify $TASK_ID_1",
        "reason": "rerun missing or stale verifiers",
        "arguments": {
          "taskId": "$TASK_ID_1",
          "workspace": "$WORKSPACE"
        }
      },
      {
        "tool": "cortex_remember",
        "command": "cortex -C $WORKSPACE remember $TASK_ID_1 OUTCOME --unverified",
        "reason": "preserve the outcome once verification is adequate",
        "arguments": {
          "taskId": "$TASK_ID_1",
          "verificationNotPossible": true,
          "workspace": "$WORKSPACE"
        },
        "inputs": [
          "outcome"
        ]
      }
    ],
    "rawAvailable": false,
    "error": "cannot complete: no adequate verification was performed (receipts are absent, blocked, inconclusive, or not_run). run cortex verify with an available verifier, or set verification_not_possible=true (CLI --unverified) to record explicitly that verification could not be performed"
  }
}
